{
  "$schema": "https://json-schema.org/draft/2020-12/schema",
  "title": "Prompt Pack Tag Taxonomy",
  "type": "object",
  "additionalProperties": false,
  "required": [
    "$schema",
    "version",
    "description",
    "categories",
    "tags"
  ],
  "properties": {
    "$schema": {
      "type": "string"
    },
    "version": {
      "type": "string"
    },
    "description": {
      "type": "string",
      "minLength": 1
    },
    "categories": {
      "type": "array",
      "minItems": 1,
      "items": {
        "$ref": "#/$defs/category"
      }
    },
    "tags": {
      "type": "array",
      "minItems": 1,
      "items": {
        "$ref": "#/$defs/tag"
      }
    }
  },
  "$defs": {
    "category": {
      "type": "object",
      "additionalProperties": false,
      "required": [
        "id",
        "name",
        "description"
      ],
      "properties": {
        "id": {
          "type": "string",
          "minLength": 1
        },
        "name": {
          "type": "string",
          "minLength": 1
        },
        "description": {
          "type": "string",
          "minLength": 1
        }
      }
    },
    "tag": {
      "type": "object",
      "additionalProperties": false,
      "required": [
        "id",
        "category",
        "description"
      ],
      "properties": {
        "id": {
          "type": "string",
          "minLength": 1
        },
        "category": {
          "type": "string",
          "minLength": 1
        },
        "description": {
          "type": "string",
          "minLength": 1
        },
        "aliases": {
          "type": "array",
          "items": {
            "type": "string",
            "minLength": 1
          },
          "uniqueItems": true
        }
      }
    }
  }
}
